date,title,duration,views,likes,comments
2021-11-25 23:29:18+00:00,We Had A Long Drive Contest W/ Bryson DeChambeau!,1130,1464386,27571,1124
2020-10-25 01:39:25+00:00,"First Person to Make A Hole in One Wins $1,000",881,399773,8795,243
2021-04-18 19:25:41+00:00,"They Challenged Us To A Golf Match for $5,000...",2099,957181,17518,959
2020-12-09 00:43:54+00:00,Good Good Plays 3v3 Scramble! W/ Kyle Berkshire,1832,395135,8899,1209
2022-01-23 18:58:34+00:00,Can The Stumps Stay Undefeated In California?! | Stumps Vs. Twigs Money Match | Part 2,1476,532301,13243,675
2021-06-16 00:45:13+00:00,Crazy 3v3 Scramble in Las Vegas!,1666,453053,13709,937
2021-10-17 17:40:41+00:00,The Craziest Ending To a 2v2v2 Scramble Yet! | Good Good,2169,963774,18249,1081
2021-02-28 20:28:40+00:00,We Caught MASSIVE Sharks W/ @BlacktipH,734,66226,4455,367
2021-11-10 16:52:59+00:00,Fortnite Meets Golf | Battle Royale Golf Challenge | Good Good,1725,547936,29098,720
2022-01-14 01:29:53+00:00,THE PLAYOFF... 3v3 18 Hole Scramble | The OceanFront Golf Match,1837,815535,23170,1382
2021-01-30 00:19:15+00:00,INSANE Florida Knockout Golf Challenge!,1831,369191,9625,786
2020-09-30 00:24:08+00:00,Good Good Goes To Mexico | INSANE RESORT,514,185715,16301,540
2021-10-22 04:01:22+00:00,First Ever 2v2v2v2 Bracket Elimination Golf Challenge | Good Good,2022,741160,17800,1251
2021-01-10 19:04:11+00:00,The Happy Gilmore Golf Challenge | Good Good,1288,629172,15575,430
2021-06-06 19:57:50+00:00,Insane Las Vegas Knockout Golf Challenge!,1590,340012,10325,616
2021-05-20 23:56:03+00:00,Playing Among Us on a Golf Course *In Real Life*,1555,536838,11956,623
2022-01-05 04:11:29+00:00,The Good Good 2v2v2 Scramble Record Score?!,1706,768580,16923,1261
2020-09-27 17:04:11+00:00,Good Good Takes Over A Waterpark For The Day,845,177497,11397,428
2021-09-10 04:36:35+00:00,Intense Texas Knockout Golf Challenge | Good Good,1354,490695,14194,957
2021-02-26 02:50:39+00:00,Our First 2v2v2 Golf Scramble | THE FINAL PART,1044,298891,13886,758
2021-03-17 00:35:54+00:00,Knockout Golf Challenge at #1 Par 3 Golf Course in America!,1351,327497,11803,756
2021-05-14 02:18:55+00:00,2v2 Wii Golf at the Good Good house,1386,307317,7518,429
2021-02-05 02:34:52+00:00,Among Us meets Golf,1767,631033,19349,1281
2021-05-23 17:00:03+00:00,Par 3 Stroke Play Face-Off | Good Good,1139,250484,6690,725
2021-08-15 18:18:38+00:00,We Played @ The Hardest Mini Golf Course in Kansas | 2v2v2 Match | Good Good,1205,1585953,22666,748
2021-05-12 00:12:55+00:00,EPIC Good Good Alternate Shot Challenge,802,170240,5722,335
2021-07-30 01:17:59+00:00,Random Golf Club Challenge | The Wheel of NOT Ideal,1745,1094056,17696,744
2021-11-14 18:23:03+00:00,KnockOut Golf Challenge in Kansas City | Good Good,1735,490997,15996,857
2020-12-24 15:00:31+00:00,Bryson DeChambeau Sets His New Speed Record?! | Good Good,560,1058750,15401,1059
2020-09-22 22:00:10+00:00,OUR BRAND NEW HOUSE!!! | Good Good House Tour 2020,683,549576,38591,2076
2021-06-03 22:57:52+00:00,Good Good Goes to Las Vegas!,497,166043,6689,357
2020-12-07 02:01:46+00:00,Knockout Golf With #1 Long Driver in The World!,1768,480717,12209,1654
2022-02-28 05:21:50+00:00,Random 1 Club KnockOut Golf Challenge | Good Good,1622,865023,23262,1121
2021-03-28 19:19:26+00:00,We Played A 3v3 Match @ The Longest Course in Florida | Part 3/3,1424,386328,8050,678
2021-05-25 14:00:23+00:00,First Team To Make A Hole In 1 Wins $1000,770,521065,20657,745
2021-10-31 18:49:30+00:00,3v3 Thrift Store Golf Challenge REMATCH! | Good Good,2509,878801,15293,1002
2021-12-17 00:34:41+00:00,The Good Good Office Reveal! | We Got A Trackman Golf Simulator,608,392219,15965,1287
2020-12-07 02:01:46+00:00,Knockout Golf With #1 Long Driver in The World!,1768,480717,12209,1654
2021-01-30 00:19:15+00:00,INSANE Florida Knockout Golf Challenge!,1831,369191,9625,786
2020-09-27 17:04:11+00:00,Good Good Takes Over A Waterpark For The Day,845,177497,11397,428
2021-10-31 18:49:30+00:00,3v3 Thrift Store Golf Challenge REMATCH! | Good Good,2509,878801,15293,1002
2020-12-09 00:43:54+00:00,Good Good Plays 3v3 Scramble! W/ Kyle Berkshire,1832,395135,8899,1209
2021-05-14 02:18:55+00:00,2v2 Wii Golf at the Good Good house,1386,307317,7518,429
2020-10-02 13:54:50+00:00,Most Epic Golf Course In Mexico?! | 3v3 Scramble | Good Good,1873,694476,15562,1111
2021-01-27 02:33:33+00:00,The GREATEST Golf Match in YouTube History!,1808,1487000,136812,3476
2021-03-28 19:19:26+00:00,We Played A 3v3 Match @ The Longest Course in Florida | Part 3/3,1424,386328,8050,678
2020-09-22 22:00:10+00:00,OUR BRAND NEW HOUSE!!! | Good Good House Tour 2020,683,549576,38591,2076
2021-03-17 00:35:54+00:00,Knockout Golf Challenge at #1 Par 3 Golf Course in America!,1351,327497,11803,756
2022-03-04 05:43:18+00:00,The Greatest 6v6 Golf Match In YouTube History | Good Good,3483,1780845,32206,2108
2021-12-15 00:40:20+00:00,1v1 Mario Golf Bracket Challenge! | Good Good,1545,539521,11378,506
2021-07-04 14:00:00+00:00,Good Good Celebrates The Fourth of July!,697,183738,8181,549
2021-10-08 02:27:04+00:00,EPIC 3v3 Mini Golf Battle | Stumps vs. Twigs | Good Good,1722,1070930,20588,1069
2021-05-23 17:00:03+00:00,Par 3 Stroke Play Face-Off | Good Good,1139,250484,6690,725
2021-12-23 22:56:02+00:00,6 High School Golfers Challenged Us To A Rematch... | Good Good,2416,560428,10581,646
2021-12-22 00:49:05+00:00,CRAZY Top Golf Target Elimination Challenge | Good Good,1318,913762,16222,717
2021-05-12 00:12:55+00:00,EPIC Good Good Alternate Shot Challenge,802,170240,5722,335
2021-01-01 04:03:30+00:00,Good Good 7 Iron Only Challenge,2146,689782,12237,684
2022-02-09 04:33:47+00:00,This Is The Craziest Mini Golf Course In The World!! | 3v3 Mini Golf Battle | Good Good,2821,749068,15955,1400
2022-01-26 06:40:05+00:00,Can We Beat The Good Good 2v2v2 Scramble Record Score?!,2108,630232,16508,1054
2020-12-27 19:36:25+00:00,Good Good Wii Golf Tournament | Part 1/2,1892,791202,12903,605
2021-07-08 14:06:23+00:00,The Greatest Golf Shot in YouTube History.,1986,3800705,207309,6787
2020-12-20 18:49:14+00:00,Good Good Plays America's Greatest Golf Holes | Amen Corner | PART 3,1672,452530,28776,869
2021-04-25 17:45:04+00:00,We Had A Match With A New Good Good Member?!? | INSANE COMEBACK!!!,1631,556714,11836,690
2021-04-01 14:00:03+00:00,IT'S FINALLY HERE! - Good Good Golf Apparel,1123,119050,5627,1684
2020-11-04 01:48:43+00:00,Our Brand New Custom GOOD GOOD Golf Scooters!,556,137437,4261,190
